{
  "eventId": "b2d4f6a8-1234-4abc-9def-8a7b6c5d4e3f",
  "eventType": "InventoryUpdated",
  "schemaVersion": "1.0",
  "correlationId": "6f2b1a3e-2c31-4e9a-9a2d-1a7b6f8e2b10",
  "occurredAt": "2026-07-28T10:16:03.442Z",
  "sku": "NB-TENT-2P-GRN",
  "orderId": "ORD-100301",
  "quantityDelta": -1,
  "availableQuantity": 42,
  "replenishmentTriggered": false
}
